{
  "schema_version": "net.stream.envelope.v1",
  "stream_id": "stream_demo_001",
  "invocation_id": "invocation_demo_001",
  "trace_id": "trace_demo_001",
  "sequence": 3,
  "event_kind": "metric",
  "stream_state": "open",
  "payload_kind": "metric",
  "origin_node_id": "node_external_demo",
  "target_node_id": "node_local_demo",
  "timestamp_unix_ms": 1700000000300,
  "payload": {
    "name": "first_chunk_ms",
    "value": 200,
    "unit": "ms"
  }
}
