{
  "schema_version": "net.stream.envelope.v1",
  "stream_id": "stream_demo_001",
  "invocation_id": "invocation_demo_001",
  "trace_id": "trace_demo_001",
  "sequence": 4,
  "event_kind": "receipt",
  "stream_state": "open",
  "payload_kind": "receipt",
  "origin_node_id": "node_external_demo",
  "target_node_id": "node_local_demo",
  "timestamp_unix_ms": 1700000000400,
  "payload": {
    "receipt_id": "receipt_demo_001",
    "authority": "transported_not_authoritative"
  }
}
