{
  "schema_version": "net.stream.envelope.v1",
  "stream_id": "stream_demo_001",
  "invocation_id": "invocation_demo_001",
  "trace_id": "trace_demo_001",
  "sequence": 5,
  "event_kind": "complete",
  "stream_state": "completed",
  "payload_kind": "none",
  "origin_node_id": "node_external_demo",
  "target_node_id": "node_local_demo",
  "timestamp_unix_ms": 1700000000600,
  "payload": null
}
