{
  "schema_version": "net.stream.envelope.v1",
  "stream_id": "stream_demo_001",
  "invocation_id": "invocation_demo_001",
  "trace_id": "trace_demo_001",
  "sequence": 0,
  "event_kind": "request",
  "stream_state": "created",
  "payload_kind": "json",
  "origin_node_id": "node_local_demo",
  "target_node_id": "node_external_demo",
  "timestamp_unix_ms": 1700000000000,
  "payload": {
    "operation": "generic.external.request",
    "input_ref": "input_demo_001"
  }
}
